{
  "schemaVersion": "golden-path-metadata/v1",
  "contractVersion": "golden-path/v1",
  "standardVersion": "2026.08.3",
  "assetBundleVersion": "1.0.0",
  "applicability": {
    "status": "applicable"
  },
  "profiles": [
    "node-typescript",
    "infrastructure-aws-cdk"
  ],
  "artifactTypes": [
    "service",
    "infrastructure"
  ],
  "capabilities": [
    "format",
    "lint",
    "typecheck",
    "test",
    "build",
    "dependency-automation"
  ],
  "targets": [
    {
      "os": "linux",
      "architecture": "amd64",
      "runtime": "node-24",
      "tier": "primary",
      "execution": true
    }
  ]
}
